{
  "schema_version": "1.0", "review_id": "review-dry-run-s03-pass", "task_id": "task-dry-run-review-repair", "reviewer_role": "independent", "reviewed_revision": {"base_commit": null, "result_commit": null}, "verdict": "approved", "findings": [], "reviewed_scenario_ids": [], "validation_evidence": [{"path": ".afd/dry-run/sample-validation/s03.json", "status": "passed"}], "unresolved_questions": [], "timestamp": "2026-07-29T14:25:00Z"
}
